{
  "schema_version": "status-sovereignty-open-obligation-first-pass@1",
  "hypothesis_id": "SSC-H01",
  "issue": 541,
  "observation_id": "SSC-OBS-0008",
  "lane_id": "SSC-F10",
  "as_of": "2026-07-31",
  "title": "SBIC Critical Technologies applicant, leverage, performance, and recovery denominator · first pass",
  "status": "application_and_first_cohort_checkpoints_recovered_fund_level_flow_and_recovery_open",
  "authority": "source_acquisition_only_not_review_or_adjudication",
  "parent_custody": {
    "path": "data/research/status-sovereignty-wave-01-targeted-acquisition.json",
    "state": "partially_repaired_open"
  },
  "sources": [
    {
      "source_id": "SSC-SBICCT-FP-S001",
      "title": "SBA and DoD Celebrate Successful First Year for the SBIC Critical Technology Initiative",
      "publisher": "U.S. Small Business Administration",
      "url": "https://www.sba.gov/article/2024/10/22/us-small-business-administration-department-defense-celebrate-successful-first-year-small-business",
      "source_class": "official_program_checkpoint",
      "retrieved_facts": [
        "More than 100 funds had expressed interest.",
        "Twenty-two funds had submitted formal applications since the initiative began accepting applications in fall 2023.",
        "Thirteen funds were approved for Green Light or licensing as of 2024-10-22.",
        "The thirteen funds planned to raise 2.8 billion dollars in private capital and were eligible for SBA-guaranteed leverage after licensing.",
        "The program distinguished interest, application, approval, licensing, and access to guaranteed leverage."
      ]
    },
    {
      "source_id": "SSC-SBICCT-FP-S002",
      "title": "DoD and SBA Publish Names of First 18 Licensed and Green Light Approved Funds",
      "publisher": "U.S. Department of Defense",
      "url": "https://www.defense.gov/News/Releases/Release/Article/4032999/department-of-defense-and-us-small-business-administration-publish-names-of-fir/",
      "source_class": "official_first_cohort_checkpoint",
      "retrieved_facts": [
        "The first published cohort contained eighteen funds.",
        "Seventeen funds were publicly named and one fund identity was withheld under SBA policy.",
        "Seven funds were described as fully licensed and investing at the 2025-01-17 checkpoint.",
        "Published cohort projections were not realized investment, performance, repayment, or public recovery."
      ]
    },
    {
      "source_id": "SSC-SBICCT-FP-S003",
      "title": "Investment Policy Statement, Small Business Investment Company Critical Technology Initiative",
      "publisher": "U.S. Small Business Administration",
      "url": "https://www.sba.gov/document/policy-guidance-investment-policy-statement-small-business-investment-company-critical-technology-initiative",
      "source_class": "official_policy_and_governance_contract",
      "retrieved_facts": [
        "The policy statement describes portfolio objectives, SBA and DoD governance, risk management, monitoring, and reporting.",
        "Program-level monitoring and leverage authority do not disclose every applicant, fund-level instrument, draw, portfolio outcome, or repayment."
      ]
    }
  ],
  "recovered_checkpoints": {
    "expressions_of_interest_minimum": 100,
    "formal_applications_as_of_2024_10_22": 22,
    "approved_as_of_2024_10_22": 13,
    "first_published_cohort": 18,
    "publicly_named_first_cohort": 17,
    "withheld_first_cohort": 1,
    "fully_licensed_as_of_2025_01_17": 7
  },
  "state_distinctions": [
    "interest_not_application",
    "application_not_approval",
    "green_light_not_license",
    "license_not_leverage_commitment",
    "commitment_not_draw",
    "fund_draw_not_portfolio_investment",
    "portfolio_investment_not_realized_performance",
    "projected_investment_not_public_benefit",
    "repayment_machinery_not_observed_public_recovery"
  ],
  "open_denominators": [
    "identity and disposition of every formal applicant",
    "complete later-cohort applicant, rejection, withdrawal, and withheld-fund universe",
    "selection scores, committee records, conflicts, exceptions, and overrides",
    "fund-level Green Light, license, leverage commitment, draw, fee, covenant, and amendment chronology",
    "complete portfolio investment, follow-on, exit, write-off, default, return, and repayment ledger",
    "named unsuccessful and nonselected controls",
    "observed program-level public recovery and loss allocation"
  ],
  "current_result": {
    "terminal_state": "requires_additional_acquisition",
    "reviewed_disposition_changed": false,
    "complete_public_private_risk_and_recovery_chain": false,
    "capital_conversion_finding": false,
    "complete_compact_finding": false,
    "graph_effect": "none",
    "publication_effect": "none"
  },
  "boundaries": {
    "program_membership_proves_favoritism": false,
    "license_proves_leverage_draw": false,
    "projected_portfolio_count_proves_realized_investment": false,
    "private_return_proves_public_recovery": false,
    "public_leverage_proves_extraction": false,
    "shared_program_proves_coordination": false,
    "graph_effect": "none"
  }
}
